sectionId,postDate,expiryDate,deletedWithEntryType,_authorId,id,tempId,draftId,revisionId,isProvisionalDraft,uid,siteSettingsId,fieldLayoutId,contentId,enabled,archived,siteId,title,slug,uri,dateCreated,dateUpdated,dateLastMerged,dateDeleted,trashed,isNewForSite,canonicalId,isDraft,isRevision,isUnpublishedDraft,ref,status,structureId,url,authorId,typeId,authorTitle,authorImage,authorBio,seo
3,2023-06-12T07:50:00-04:00,,,452183,983708,,,,,991cebda-c0dc-4b44-9cd8-aad6389396bc,1464479,,595049,1,,1,"Adonis Celestine",adonis-celestine,blog/author/adonis-celestine,2023-06-12T07:48:25-04:00,2023-06-12T09:43:15-04:00,,,,,983708,,,,authors/adonis-celestine,live,,https://www.applause.com/blog/author/adonis-celestine,452183,3,"Senior Director and Automation Practice Lead",[983709],"<p dir=""ltr"">Adonis Celestine is Senior Director and Automation Practice Lead at Applause. In this role, Adonis helps Applause’s clients to take a customer-centric approach to quality as part of their quality engineering evolution. He is an expert in test data management and compliance, as well as automation tools including Selenium, Cypress, Playwright, Tosca, UFT and Leapwork. Before joining Applause, Adonis was Associate Director and Lead Solutions Architect at Cognizant and held diverse quality engineering roles across the finance and telecommunications sectors, working for brands including Lloyds Banking Group, de Volksbank, DLL, Tele2 and Rabobank.</p>
<p dir=""ltr"">Adonis is an accomplished writer and public speaker. He is the author of “Quality Engineering: The Missing Key to Digital CX” (2022), “Continuous Quality: The Secret of the Pharaohs” (2021), which won the EuroSTAR Software Testing Award, and “As the World Turns: A Predictive Test Approach with Machine Learning” (2019). He has delivered speeches and keynotes at events including TestNet, Testdag, Testcon, EuroSTAR, Romania Testing Conference and Belgium Testing Days. Adonis regularly writes for multiple tech publications and his articles have been featured in AI Journal, Digital IT News and AT Today.</p>
<p><br /></p>","{""bundleVersion"":""1.0.23"",""sourceBundleType"":""field"",""sourceId"":null,""sourceName"":null,""sourceHandle"":null,""sourceType"":""field"",""typeId"":null,""sourceTemplate"":"""",""sourceSiteId"":null,""sourceAltSiteSettings"":[],""sourceDateUpdated"":""2023-06-12T07:53:07-04:00"",""metaGlobalVars"":{""language"":null,""mainEntityOfPage"":"""",""seoTitle"":""Adonis Celestine | Author"",""siteNamePosition"":"""",""seoDescription"":""Adonis Celestine is Senior Director and Automation Practice Lead at Applause. He is a respected thought leader and accomplished author and public speaker."",""seoKeywords"":"""",""seoImage"":"""",""seoImageWidth"":"""",""seoImageHeight"":"""",""seoImageDescription"":""Adonis Celestine | Headshot"",""canonicalUrl"":"""",""robots"":""all"",""ogType"":"""",""ogTitle"":"""",""ogSiteNamePosition"":"""",""ogDescription"":"""",""ogImage"":"""",""ogImageWidth"":"""",""ogImageHeight"":"""",""ogImageDescription"":"""",""twitterCard"":"""",""twitterCreator"":"""",""twitterTitle"":"""",""twitterSiteNamePosition"":"""",""twitterDescription"":"""",""twitterImage"":"""",""twitterImageWidth"":"""",""twitterImageHeight"":"""",""twitterImageDescription"":"""",""inherited"":{""seoImage"":true,""robots"":true,""canonicalUrl"":true},""overrides"":{""seoTitle"":true,""seoDescription"":true,""seoImageDescription"":true}},""metaSiteVars"":{""siteName"":""Englisch"",""identity"":null,""creator"":null,""twitterHandle"":"""",""facebookProfileId"":"""",""facebookAppId"":"""",""googleSiteVerification"":"""",""bingSiteVerification"":"""",""pinterestSiteVerification"":"""",""facebookSiteVerification"":"""",""sameAsLinks"":[],""siteLinksSearchTarget"":"""",""siteLinksQueryInput"":"""",""referrer"":""no-referrer-when-downgrade"",""additionalSitemapUrls"":[],""additionalSitemapUrlsDateUpdated"":null,""additionalSitemaps"":[]},""metaSitemapVars"":{""sitemapUrls"":false,""sitemapAssets"":null,""sitemapFiles"":null,""sitemapAltLinks"":false,""sitemapChangeFreq"":"""",""sitemapPriority"":"""",""sitemapLimit"":null,""structureDepth"":null,""sitemapImageFieldMap"":[],""sitemapVideoFieldMap"":[],""inherited"":{""sitemapUrls"":true,""sitemapAltLinks"":true},""overrides"":[]},""metaContainers"":{""MetaTagContainergeneral"":{""data"":[],""name"":""General"",""description"":""General Meta Tags"",""class"":""nystudio107\\seomatic\\models\\MetaTagContainer"",""handle"":""general"",""include"":true,""dependencies"":[],""clearCache"":false},""MetaTagContaineropengraph"":{""data"":[],""name"":""Facebook"",""description"":""Facebook OpenGraph Meta Tags"",""class"":""nystudio107\\seomatic\\models\\MetaTagContainer"",""handle"":""opengraph"",""include"":true,""dependencies"":[],""clearCache"":false},""MetaTagContainertwitter"":{""data"":[],""name"":""Twitter"",""description"":""Twitter Card Meta Tags"",""class"":""nystudio107\\seomatic\\models\\MetaTagContainer"",""handle"":""twitter"",""include"":true,""dependencies"":[],""clearCache"":false},""MetaTagContainermiscellaneous"":{""data"":[],""name"":""Miscellaneous"",""description"":""Miscellaneous Meta Tags"",""class"":""nystudio107\\seomatic\\models\\MetaTagContainer"",""handle"":""miscellaneous"",""include"":true,""dependencies"":[],""clearCache"":false},""MetaLinkContainergeneral"":{""data"":[],""name"":""General"",""description"":""Link Tags"",""class"":""nystudio107\\seomatic\\models\\MetaLinkContainer"",""handle"":""general"",""include"":true,""dependencies"":[],""clearCache"":false},""MetaScriptContainergeneral"":{""data"":[],""position"":1,""name"":""General"",""description"":""Script Tags"",""class"":""nystudio107\\seomatic\\models\\MetaScriptContainer"",""handle"":""general"",""include"":true,""dependencies"":[],""clearCache"":false},""MetaJsonLdContainergeneral"":{""data"":[],""name"":""General"",""description"":""JsonLd Tags"",""class"":""nystudio107\\seomatic\\models\\MetaJsonLdContainer"",""handle"":""general"",""include"":true,""dependencies"":[],""clearCache"":false},""MetaTitleContainergeneral"":{""data"":[],""name"":""General"",""description"":""Meta Title Tag"",""class"":""nystudio107\\seomatic\\models\\MetaTitleContainer"",""handle"":""general"",""include"":true,""dependencies"":[],""clearCache"":false}},""redirectsContainer"":[],""frontendTemplatesContainer"":{""data"":[],""name"":null,""description"":null,""class"":""nystudio107\\seomatic\\models\\FrontendTemplateContainer"",""handle"":null,""include"":true,""dependencies"":null,""clearCache"":false},""metaBundleSettings"":{""siteType"":"""",""siteSubType"":"""",""siteSpecificType"":"""",""seoTitleSource"":""fromCustom"",""seoTitleField"":""title"",""siteNamePositionSource"":"""",""seoDescriptionSource"":""fromCustom"",""seoDescriptionField"":""title"",""seoKeywordsSource"":""fromCustom"",""seoKeywordsField"":"""",""seoImageIds"":"""",""seoImageSource"":""fromAsset"",""seoImageField"":""authorImage"",""seoImageTransform"":""1"",""seoImageTransformMode"":""crop"",""seoImageDescriptionSource"":""fromCustom"",""seoImageDescriptionField"":""title"",""twitterCreatorSource"":"""",""twitterCreatorField"":"""",""twitterTitleSource"":"""",""twitterTitleField"":"""",""twitterSiteNamePositionSource"":"""",""twitterDescriptionSource"":"""",""twitterDescriptionField"":"""",""twitterImageIds"":[],""twitterImageSource"":"""",""twitterImageField"":"""",""twitterImageTransform"":true,""twitterImageTransformMode"":""crop"",""twitterImageDescriptionSource"":"""",""twitterImageDescriptionField"":"""",""ogTitleSource"":"""",""ogTitleField"":"""",""ogSiteNamePositionSource"":"""",""ogDescriptionSource"":"""",""ogDescriptionField"":"""",""ogImageIds"":[],""ogImageSource"":"""",""ogImageField"":"""",""ogImageTransform"":true,""ogImageTransformMode"":""crop"",""ogImageDescriptionSource"":"""",""ogImageDescriptionField"":""""}}"
3,2023-05-09T11:03:00-04:00,,,377321,969309,,,,,f468a432-a053-4ae7-aa1e-a9c02bc7fee3,1445907,,583518,1,,1,"Bob Farrell",bob-farrell,blog/author/bob-farrell,2023-05-09T11:02:23-04:00,2023-05-16T12:11:29-04:00,,,,,969309,,,,authors/bob-farrell,live,,https://www.applause.com/blog/author/bob-farrell,377321,3,"Vice President of Solution Delivery and CX Practices",[969310],"<p>Bob Farrell, Vice President of Solution Delivery and CX Practices for Applause, is a technology executive with more than 20 years of experience establishing programs that help his customers deliver high quality digital experiences to their customers. Bob has helped hundreds of digital innovators build and implement market-leading digital quality programs, and views product quality as a competitive differentiator. He spearheads groundbreaking innovation as leader of the digital accessibility conformance, UX research, and inclusive design practices, and manages customer success within the high tech and financial services practices with Applause. </p>
<p>Prior to his work with Applause, Bob specialized in digital product management, launching products globally for the financial, digital marketing, and museum industries.</p>
<p>Bob graduated with summa cum laude and Phi Beta Kappa honors from the State University of New York at Buffalo. He also holds a graduate certificate in object-oriented computing from Montclair State University. In his free time, Bob enjoys skiing, playing tennis and following international affairs. <br /></p>","{""bundleVersion"":""1.0.23"",""sourceBundleType"":""field"",""sourceId"":null,""sourceName"":null,""sourceHandle"":null,""sourceType"":""field"",""typeId"":null,""sourceTemplate"":"""",""sourceSiteId"":null,""sourceAltSiteSettings"":[],""sourceDateUpdated"":""2023-05-16T12:11:29-04:00"",""metaGlobalVars"":{""language"":null,""mainEntityOfPage"":"""",""seoTitle"":""Bob Farrell | Author"",""siteNamePosition"":"""",""seoDescription"":""Bob Farrell is a technology executive with more than 20 years of experience establishing programs that help customers deliver high-quality digital experiences."",""seoKeywords"":"""",""seoImage"":"""",""seoImageWidth"":"""",""seoImageHeight"":"""",""seoImageDescription"":"""",""canonicalUrl"":"""",""robots"":""all"",""ogType"":"""",""ogTitle"":"""",""ogSiteNamePosition"":"""",""ogDescription"":"""",""ogImage"":"""",""ogImageWidth"":"""",""ogImageHeight"":"""",""ogImageDescription"":"""",""twitterCard"":"""",""twitterCreator"":"""",""twitterTitle"":"""",""twitterSiteNamePosition"":"""",""twitterDescription"":"""",""twitterImage"":"""",""twitterImageWidth"":"""",""twitterImageHeight"":"""",""twitterImageDescription"":"""",""inherited"":{""seoImage"":true,""seoImageDescription"":true,""robots"":true,""canonicalUrl"":true},""overrides"":{""seoTitle"":true,""seoDescription"":true}},""metaSiteVars"":{""siteName"":""English"",""identity"":null,""creator"":null,""twitterHandle"":"""",""facebookProfileId"":"""",""facebookAppId"":"""",""googleSiteVerification"":"""",""bingSiteVerification"":"""",""pinterestSiteVerification"":"""",""facebookSiteVerification"":"""",""sameAsLinks"":[],""siteLinksSearchTarget"":"""",""siteLinksQueryInput"":"""",""referrer"":""no-referrer-when-downgrade"",""additionalSitemapUrls"":[],""additionalSitemapUrlsDateUpdated"":null,""additionalSitemaps"":[]},""metaSitemapVars"":{""sitemapUrls"":false,""sitemapAssets"":null,""sitemapFiles"":null,""sitemapAltLinks"":false,""sitemapChangeFreq"":"""",""sitemapPriority"":"""",""sitemapLimit"":null,""structureDepth"":null,""sitemapImageFieldMap"":[],""sitemapVideoFieldMap"":[],""inherited"":{""sitemapUrls"":true,""sitemapAltLinks"":true},""overrides"":[]},""metaContainers"":{""MetaTagContainergeneral"":{""data"":[],""name"":""General"",""description"":""General Meta Tags"",""class"":""nystudio107\\seomatic\\models\\MetaTagContainer"",""handle"":""general"",""include"":true,""dependencies"":[],""clearCache"":false},""MetaTagContaineropengraph"":{""data"":[],""name"":""Facebook"",""description"":""Facebook OpenGraph Meta Tags"",""class"":""nystudio107\\seomatic\\models\\MetaTagContainer"",""handle"":""opengraph"",""include"":true,""dependencies"":[],""clearCache"":false},""MetaTagContainertwitter"":{""data"":[],""name"":""Twitter"",""description"":""Twitter Card Meta Tags"",""class"":""nystudio107\\seomatic\\models\\MetaTagContainer"",""handle"":""twitter"",""include"":true,""dependencies"":[],""clearCache"":false},""MetaTagContainermiscellaneous"":{""data"":[],""name"":""Miscellaneous"",""description"":""Miscellaneous Meta Tags"",""class"":""nystudio107\\seomatic\\models\\MetaTagContainer"",""handle"":""miscellaneous"",""include"":true,""dependencies"":[],""clearCache"":false},""MetaLinkContainergeneral"":{""data"":[],""name"":""General"",""description"":""Link Tags"",""class"":""nystudio107\\seomatic\\models\\MetaLinkContainer"",""handle"":""general"",""include"":true,""dependencies"":[],""clearCache"":false},""MetaScriptContainergeneral"":{""data"":[],""position"":1,""name"":""General"",""description"":""Script Tags"",""class"":""nystudio107\\seomatic\\models\\MetaScriptContainer"",""handle"":""general"",""include"":true,""dependencies"":[],""clearCache"":false},""MetaJsonLdContainergeneral"":{""data"":[],""name"":""General"",""description"":""JsonLd Tags"",""class"":""nystudio107\\seomatic\\models\\MetaJsonLdContainer"",""handle"":""general"",""include"":true,""dependencies"":[],""clearCache"":false},""MetaTitleContainergeneral"":{""data"":[],""name"":""General"",""description"":""Meta Title Tag"",""class"":""nystudio107\\seomatic\\models\\MetaTitleContainer"",""handle"":""general"",""include"":true,""dependencies"":[],""clearCache"":false}},""redirectsContainer"":[],""frontendTemplatesContainer"":{""data"":[],""name"":null,""description"":null,""class"":""nystudio107\\seomatic\\models\\FrontendTemplateContainer"",""handle"":null,""include"":true,""dependencies"":null,""clearCache"":false},""metaBundleSettings"":{""siteType"":"""",""siteSubType"":"""",""siteSpecificType"":"""",""seoTitleSource"":""fromCustom"",""seoTitleField"":""title"",""siteNamePositionSource"":"""",""seoDescriptionSource"":""fromCustom"",""seoDescriptionField"":""title"",""seoKeywordsSource"":""fromCustom"",""seoKeywordsField"":"""",""seoImageIds"":"""",""seoImageSource"":""fromAsset"",""seoImageField"":""authorImage"",""seoImageTransform"":""1"",""seoImageTransformMode"":""crop"",""seoImageDescriptionSource"":""fromCustom"",""seoImageDescriptionField"":""title"",""twitterCreatorSource"":"""",""twitterCreatorField"":"""",""twitterTitleSource"":"""",""twitterTitleField"":"""",""twitterSiteNamePositionSource"":"""",""twitterDescriptionSource"":"""",""twitterDescriptionField"":"""",""twitterImageIds"":[],""twitterImageSource"":"""",""twitterImageField"":"""",""twitterImageTransform"":true,""twitterImageTransformMode"":""crop"",""twitterImageDescriptionSource"":"""",""twitterImageDescriptionField"":"""",""ogTitleSource"":"""",""ogTitleField"":"""",""ogSiteNamePositionSource"":"""",""ogDescriptionSource"":"""",""ogDescriptionField"":"""",""ogImageIds"":[],""ogImageSource"":"""",""ogImageField"":"""",""ogImageTransform"":true,""ogImageTransformMode"":""crop"",""ogImageDescriptionSource"":"""",""ogImageDescriptionField"":""""}}"
3,2023-03-21T04:00:00-04:00,,,385079,957448,,,,,727fdeaa-97e4-4d83-93b6-ae8cf0b79d2f,1429177,,572776,1,,1,"Maria Mondragon Marquez",maria-mondragon-marquez,blog/author/maria-mondragon-marquez,2023-03-21T15:09:50-04:00,2023-03-21T15:28:18-04:00,,,,,957448,,,,authors/maria-mondragon-marquez,live,,https://www.applause.com/blog/author/maria-mondragon-marquez,385079,3,"Solutions Consultant, Applause",[957450],"<p>Maria supports the Applause global sales team, providing technical expertise throughout the sales cycle to consistently help Applause customers achieve digital excellence. In addition, she has years of experience in customer relationship management. Both through work and personal life, Maria has extensive global travel experiences, which have added to her expertise in helping companies achieve excellence in localization and UX projects. She is bilingual and has strong communication, organizational and presentation skills in English and Spanish. </p>
<p>In addition, Maria has 11+ years of experience in the telecommunication industry, particularly in network quality testing of 2G, 3G, LTE/IMS, IoT, and 5G technologies - testing mobile apps on Android and iOS devices.</p>
<p>In her free time, Maria enjoys spending time with family and friends, going to the beach and travelling to new places.</p>
<p>See more about <a href=""https://www.linkedin.com/in/maria-mondragon-hn/"" target=""_blank"" rel=""noreferrer noopener"">Maria on LinkedIn</a>.</p>","{""bundleVersion"":""1.0.23"",""sourceBundleType"":""field"",""sourceId"":null,""sourceName"":null,""sourceHandle"":null,""sourceType"":""field"",""typeId"":null,""sourceTemplate"":"""",""sourceSiteId"":null,""sourceAltSiteSettings"":[],""sourceDateUpdated"":""2023-03-21T15:28:16-04:00"",""metaGlobalVars"":{""language"":null,""mainEntityOfPage"":"""",""seoTitle"":""Maria Mondragon Marquez | Solutions Consultant, Applause"",""siteNamePosition"":"""",""seoDescription"":""Maria helps companies achieve excellence in localization and UX projects."",""seoKeywords"":"""",""seoImage"":"""",""seoImageWidth"":"""",""seoImageHeight"":"""",""seoImageDescription"":""Young, Hispanic woman with long, dark hair and pearl earrings wearing a black jacket and white blouse."",""canonicalUrl"":"""",""robots"":""all"",""ogType"":"""",""ogTitle"":"""",""ogSiteNamePosition"":"""",""ogDescription"":"""",""ogImage"":"""",""ogImageWidth"":"""",""ogImageHeight"":"""",""ogImageDescription"":"""",""twitterCard"":"""",""twitterCreator"":"""",""twitterTitle"":"""",""twitterSiteNamePosition"":"""",""twitterDescription"":"""",""twitterImage"":"""",""twitterImageWidth"":"""",""twitterImageHeight"":"""",""twitterImageDescription"":"""",""inherited"":{""seoImage"":true,""robots"":true,""canonicalUrl"":true},""overrides"":{""seoTitle"":true,""seoDescription"":true,""seoImageDescription"":true}},""metaSiteVars"":{""siteName"":""English"",""identity"":null,""creator"":null,""twitterHandle"":"""",""facebookProfileId"":"""",""facebookAppId"":"""",""googleSiteVerification"":"""",""bingSiteVerification"":"""",""pinterestSiteVerification"":"""",""facebookSiteVerification"":"""",""sameAsLinks"":[],""siteLinksSearchTarget"":"""",""siteLinksQueryInput"":"""",""referrer"":""no-referrer-when-downgrade"",""additionalSitemapUrls"":[],""additionalSitemapUrlsDateUpdated"":null,""additionalSitemaps"":[]},""metaSitemapVars"":{""sitemapUrls"":false,""sitemapAssets"":null,""sitemapFiles"":null,""sitemapAltLinks"":false,""sitemapChangeFreq"":"""",""sitemapPriority"":"""",""sitemapLimit"":null,""structureDepth"":null,""sitemapImageFieldMap"":[],""sitemapVideoFieldMap"":[],""inherited"":{""sitemapUrls"":true,""sitemapAltLinks"":true},""overrides"":[]},""metaContainers"":{""MetaTagContainergeneral"":{""data"":[],""name"":""General"",""description"":""General Meta Tags"",""class"":""nystudio107\\seomatic\\models\\MetaTagContainer"",""handle"":""general"",""include"":true,""dependencies"":[],""clearCache"":false},""MetaTagContaineropengraph"":{""data"":[],""name"":""Facebook"",""description"":""Facebook OpenGraph Meta Tags"",""class"":""nystudio107\\seomatic\\models\\MetaTagContainer"",""handle"":""opengraph"",""include"":true,""dependencies"":[],""clearCache"":false},""MetaTagContainertwitter"":{""data"":[],""name"":""Twitter"",""description"":""Twitter Card Meta Tags"",""class"":""nystudio107\\seomatic\\models\\MetaTagContainer"",""handle"":""twitter"",""include"":true,""dependencies"":[],""clearCache"":false},""MetaTagContainermiscellaneous"":{""data"":[],""name"":""Miscellaneous"",""description"":""Miscellaneous Meta Tags"",""class"":""nystudio107\\seomatic\\models\\MetaTagContainer"",""handle"":""miscellaneous"",""include"":true,""dependencies"":[],""clearCache"":false},""MetaLinkContainergeneral"":{""data"":[],""name"":""General"",""description"":""Link Tags"",""class"":""nystudio107\\seomatic\\models\\MetaLinkContainer"",""handle"":""general"",""include"":true,""dependencies"":[],""clearCache"":false},""MetaScriptContainergeneral"":{""data"":[],""position"":1,""name"":""General"",""description"":""Script Tags"",""class"":""nystudio107\\seomatic\\models\\MetaScriptContainer"",""handle"":""general"",""include"":true,""dependencies"":[],""clearCache"":false},""MetaJsonLdContainergeneral"":{""data"":[],""name"":""General"",""description"":""JsonLd Tags"",""class"":""nystudio107\\seomatic\\models\\MetaJsonLdContainer"",""handle"":""general"",""include"":true,""dependencies"":[],""clearCache"":false},""MetaTitleContainergeneral"":{""data"":[],""name"":""General"",""description"":""Meta Title Tag"",""class"":""nystudio107\\seomatic\\models\\MetaTitleContainer"",""handle"":""general"",""include"":true,""dependencies"":[],""clearCache"":false}},""redirectsContainer"":[],""frontendTemplatesContainer"":{""data"":[],""name"":null,""description"":null,""class"":""nystudio107\\seomatic\\models\\FrontendTemplateContainer"",""handle"":null,""include"":true,""dependencies"":null,""clearCache"":false},""metaBundleSettings"":{""siteType"":"""",""siteSubType"":"""",""siteSpecificType"":"""",""seoTitleSource"":""fromCustom"",""seoTitleField"":""title"",""siteNamePositionSource"":"""",""seoDescriptionSource"":""fromCustom"",""seoDescriptionField"":""title"",""seoKeywordsSource"":""fromCustom"",""seoKeywordsField"":"""",""seoImageIds"":"""",""seoImageSource"":""fromAsset"",""seoImageField"":""authorImage"",""seoImageTransform"":""1"",""seoImageTransformMode"":""crop"",""seoImageDescriptionSource"":""fromCustom"",""seoImageDescriptionField"":""title"",""twitterCreatorSource"":"""",""twitterCreatorField"":"""",""twitterTitleSource"":"""",""twitterTitleField"":"""",""twitterSiteNamePositionSource"":"""",""twitterDescriptionSource"":"""",""twitterDescriptionField"":"""",""twitterImageIds"":[],""twitterImageSource"":"""",""twitterImageField"":"""",""twitterImageTransform"":true,""twitterImageTransformMode"":""crop"",""twitterImageDescriptionSource"":"""",""twitterImageDescriptionField"":"""",""ogTitleSource"":"""",""ogTitleField"":"""",""ogSiteNamePositionSource"":"""",""ogDescriptionSource"":"""",""ogDescriptionField"":"""",""ogImageIds"":[],""ogImageSource"":"""",""ogImageField"":"""",""ogImageTransform"":true,""ogImageTransformMode"":""crop"",""ogImageDescriptionSource"":"""",""ogImageDescriptionField"":""""}}"
